{
  "$schema": "https://json-schema.org/draft/2020-12/schema",
  "type": "object",
  "additionalProperties": false,
  "required": [
    "summary",
    "status",
    "deliverables",
    "findings",
    "open_questions",
    "limitations",
    "confidence",
    "needs_review"
  ],
  "properties": {
    "summary": {
      "type": "string",
      "minLength": 1,
      "maxLength": 10000
    },
    "status": {
      "enum": [
        "COMPLETED",
        "PARTIAL",
        "BLOCKED"
      ]
    },
    "deliverables": {
      "type": "array",
      "maxItems": 200,
      "items": {
        "$ref": "#/$defs/deliverable"
      }
    },
    "findings": {
      "type": "array",
      "maxItems": 1000,
      "items": {
        "$ref": "#/$defs/finding"
      }
    },
    "open_questions": {
      "type": "array",
      "maxItems": 200,
      "items": {
        "$ref": "#/$defs/openQuestion"
      }
    },
    "limitations": {
      "type": "array",
      "maxItems": 200,
      "items": {
        "type": "string",
        "minLength": 1,
        "maxLength": 4000
      }
    },
    "confidence": {
      "type": [
        "number",
        "null"
      ],
      "minimum": 0,
      "maximum": 1
    },
    "needs_review": {
      "type": "boolean"
    }
  },
  "$defs": {
    "key": {
      "type": "string",
      "pattern": "^[a-z][a-z0-9_.-]*$",
      "maxLength": 128
    },
    "deliverable": {
      "type": "object",
      "additionalProperties": false,
      "required": [
        "key",
        "kind",
        "title"
      ],
      "properties": {
        "key": {
          "$ref": "#/$defs/key"
        },
        "kind": {
          "enum": [
            "report",
            "structured_data",
            "patch",
            "change_proposal",
            "artifact"
          ]
        },
        "title": {
          "type": "string",
          "minLength": 1,
          "maxLength": 500
        },
        "description": {
          "type": "string",
          "minLength": 1,
          "maxLength": 4000
        },
        "content": {
          "type": "string",
          "minLength": 1,
          "maxLength": 200000
        },
        "artifact": {
          "type": "string",
          "pattern": "^A[0-9a-f]{12}$",
          "description": "Select the published artifact label from tool result_references."
        }
      }
    },
    "finding": {
      "type": "object",
      "additionalProperties": false,
      "required": [
        "key",
        "title",
        "detail",
        "sources"
      ],
      "properties": {
        "key": {
          "$ref": "#/$defs/key"
        },
        "title": {
          "type": "string",
          "minLength": 1,
          "maxLength": 500
        },
        "detail": {
          "type": "string",
          "minLength": 1,
          "maxLength": 20000
        },
        "severity": {
          "enum": [
            "info",
            "low",
            "medium",
            "high",
            "critical"
          ]
        },
        "sources": {
          "type": "array",
          "maxItems": 500,
          "uniqueItems": true,
          "items": {
            "type": "string",
            "pattern": "^E[0-9a-f]{12}$"
          },
          "description": "Select evidence labels from tool result_references for this finding."
        }
      }
    },
    "openQuestion": {
      "type": "object",
      "additionalProperties": false,
      "required": [
        "key",
        "question"
      ],
      "properties": {
        "key": {
          "$ref": "#/$defs/key"
        },
        "question": {
          "type": "string",
          "minLength": 1,
          "maxLength": 4000
        }
      }
    }
  },
  "title": "skillmind.model-outcome/v1"
}
